{
  "stage": "assess",
  "completedAt": "2026-10-04T02:42:54Z",
  "outputs": [
    "assessment.md"
  ],
  "nextStage": "analyze",
  "summaryForNext": "0/5 goals met; all A1-A4 defects confirmed on upstream main (A4 categories filter advertised in MCP but dropped in storage; A2 also emits null agent_id from add_task_step). Must decide in analyze: replace/wrap/migrate the existing agent-team-creator memory.mts writer, Codex delivery via the plugin hook path (spike), and the operator-gated mini half of A5 (gitlinks+versions.toml) which blocks D1. Plan file paths corrected in assessment section D; renaming iterative-evolver agents is rejected in favour of namespaced matchers.",
  "skipped": false,
  "skipReason": null
}
