{
  "stage": "analyze",
  "completedAt": "2026-06-11T23:32:03Z",
  "outputs": [],
  "nextStage": "spec",
  "summaryForNext": "skipped: no external research — all pieces reuse in-repo patterns (mem0-compress HTTP, builtin hooks, rust-cli CI job)",
  "skipped": true,
  "skipReason": "no external research — all pieces reuse in-repo patterns (mem0-compress HTTP, builtin hooks, rust-cli CI job)"
}
