{
  "stage": "plan",
  "completedAt": "2026-10-05T12:38:09Z",
  "outputs": [
    "plan.md",
    "spec-index.json",
    "scope-amendment.md",
    "pin-proposal.md",
    "historical-closure-map.md",
    "verification-contract.md"
  ],
  "nextStage": "execute",
  "summaryForNext": "18 native changes and 40 tasks are registered; first is change-ldd-13-source-convergence task 1, followed by hooks and Codex priorities, remaining debt, Companion publication preparation, complete README/team/model/service/site content and one final local certification boundary. Task model assignments in plan.md use concrete native workers with unresolved team routing and different-family review prerequisites; the owner-selected full skill-system pin is ba5c4516fd72e60c21ab3bb1d09a63105aeb3c61, while other release identities and concrete protected-edit/tag/home approvals remain pending. Planning is complete but production/review/gates/publication are not; preserve five unfinished historical tasks including those nested under completed changes, three taskless pending changes, 18 blockers and 27 obligations, and never fabricate historical receipts.",
  "skipped": false,
  "skipReason": null
}
