{
  "stage": "plan",
  "completedAt": "2026-10-04T03:17:09Z",
  "outputs": [
    "plan.md"
  ],
  "nextStage": "execute",
  "summaryForNext": "25 changes / 82 tasks in 10 dependency rounds, registered with the runtime. Round 1: A1, A2, A4 (Rust, serialised), B1, D2. Critical path A1->A3->A5a->B3->B4->B5 (B1->B2 ties by task count); phase end bound by operator-owned A5b->D1b. Task model assignments in plan.md: all claude-opus-5-5 native, A5b/3 operator. Review PASS, all warnings incorporated.",
  "skipped": false,
  "skipReason": null
}
