{
  "stage": "reflect",
  "completedAt": "2026-10-04T01:02:55Z",
  "outputs": [
    "reflection.md"
  ],
  "nextStage": null,
  "summaryForNext": "4/4 changes done; goals 2-4 MET (design), 1 and 5 PARTIAL because Codex runtime injection is UNVERIFIABLE. Next phase seed: team-aware-learning-memory-impl (A1-A5 upstream + pin bump, B1-B5 to alpha gate, B6-B7 to beta gate). Prereqs: merge #124/#125, restore plugin generation.",
  "skipped": false,
  "skipReason": null
}
