{
  "stage": "assess",
  "completedAt": "2026-07-09T16:21:09Z",
  "outputs": [
    "assessment.md"
  ],
  "nextStage": "analyze",
  "summaryForNext": "Re-verified phase-prui-polish post-close: all 4 goals (G-01..G-04) still MET, zero drift/regressions since reflection. No new work proposed.",
  "skipped": false,
  "skipReason": null
}
