{
  "stage": "execute",
  "completedAt": "2026-09-24T16:55:57.416Z",
  "outputs": [
    "team-verification.json",
    "publication.json",
    "correction-ledger.md"
  ],
  "nextStage": "reflect",
  "summaryForNext": "Two changes verified and archived; local gates and independent reviews pass. Source commits pushed and remote SHAs confirmed. Reflect must retain native/Windows/remote-memory limits.",
  "skipped": false,
  "skipReason": null
}