{
  "stage": "analyze",
  "completedAt": "2026-10-18T02:19:28Z",
  "outputs": [
    "analysis.md"
  ],
  "nextStage": "spec",
  "summaryForNext": "Bounded build-vs-adopt complete: contract=phase JSON + kbd decision record digest seam; gate=stage-gate.sh extension + read-only readiness checker; no Rust/Cargo; boundary-only verification",
  "skipped": false,
  "skipReason": null
}
