{
  "stage": "reflect",
  "completedAt": "2026-06-12T16:56:02Z",
  "outputs": [
    "reflection.md"
  ],
  "nextStage": null,
  "summaryForNext": "2-change fix COMPLETE + live-verified: bash now writes add_memory via REST (POST /api/v1/memory), outbox drains, mem0-compress honest. KEY: Phase 4 memory write-back was non-functional for 6 phases (405 + never-draining outbox); a live round-trip test would have caught it. Follow-ups: agent-drain for task-streams (MCP-only), drop unverified entity mappings (YAGNI).",
  "skipped": false,
  "skipReason": null
}
