{
  "stage": "plan",
  "completedAt": "2026-06-11T22:17:25Z",
  "outputs": [
    "plan.md"
  ],
  "nextStage": "execute",
  "summaryForNext": "5 ordered changes; backend+wiring first (G2,G4/CF-5), then spec/analyze/elicit stages. First: change-001-native-kbd-backend.",
  "skipped": false,
  "skipReason": null
}
